{
  "benchmark_version": "semantic-benchmark/1.1.0",
  "fixtures": [
    {
      "activity_id": "act_03_puesto_de_limonada",
      "fixture_id": "p09_fixture_act_03",
      "questions": [
        {
          "question_fixture_id": "P09-A03-Q01",
          "support_refs": [
            {
              "declared_ref": "01_assignment.docx#Costos autorizados y precio de venta",
              "resolved_units": [
                {
                  "evidence_id": "ev_5ff5151ed9200d300514",
                  "locator": {
                    "heading_path": [
                      "Escenario"
                    ],
                    "kind": "DOCUMENT_PATH",
                    "paragraph_index": 5
                  },
                  "normalized_hash": "sha256:fd8d3d643269521540da8f2176c7ad8b724c4c43b804839fdc153b1685a9210e"
                },
                {
                  "evidence_id": "ev_6163484d46d5482d25c9",
                  "locator": {
                    "heading_path": [
                      "Escenario",
                      "Decisiones disponibles"
                    ],
                    "kind": "DOCUMENT_PATH",
                    "paragraph_index": 9
                  },
                  "normalized_hash": "sha256:8e797e369048f018cf2b752d703f55779dc07fd030a1f9e47da70f54e95fe355"
                },
                {
                  "evidence_id": "ev_7e9bcd53ab47822cc98a",
                  "locator": {
                    "heading_path": [
                      "Escenario",
                      "Decisiones disponibles"
                    ],
                    "kind": "DOCUMENT_PATH",
                    "paragraph_index": 10
                  },
                  "normalized_hash": "sha256:e2629677d1fc0314082b9d751f50a12f8aec92ded02f908950dbd3e3045badbd"
                }
              ],
              "role": "SOURCE_CONTEXT"
            },
            {
              "declared_ref": "submissions/submission_05.pdf#Elección y tabla de cálculos",
              "resolved_units": [
                {
                  "evidence_id": "ev_feec60e20d7ec1ae8c7d",
                  "locator": {
                    "bbox": [
                      67.2,
                      105.627,
                      118.613,
                      118.127
                    ],
                    "block_index": 2,
                    "kind": "PAGE_BBOX",
                    "page": 1
                  },
                  "normalized_hash": "sha256:285512032f13522046e62f6796ddecc3a425a5792e95cb832492d053e62d0f9d"
                },
                {
                  "evidence_id": "ev_eb6ad6f0bd45703e16ba",
                  "locator": {
                    "bbox": [
                      72.2,
                      174.634,
                      403.198,
                      182.334
                    ],
                    "block_index": 5,
                    "kind": "PAGE_BBOX",
                    "page": 1
                  },
                  "normalized_hash": "sha256:7534ce93353ae3bea4fdb0716e38bd5b0c735e49cc257ed906e57dffc951224a"
                },
                {
                  "evidence_id": "ev_3ea45e0cd35c8c3c2705",
                  "locator": {
                    "bbox": [
                      72.2,
                      193.934,
                      405.347,
                      201.634
                    ],
                    "block_index": 6,
                    "kind": "PAGE_BBOX",
                    "page": 1
                  },
                  "normalized_hash": "sha256:692eca935128dec215056e655fbfb6b04f89ad8f545dd8b500f05c0971bcc02f"
                },
                {
                  "evidence_id": "ev_637254fccf82757f2672",
                  "locator": {
                    "bbox": [
                      72.2,
                      213.234,
                      405.347,
                      220.934
                    ],
                    "block_index": 7,
                    "kind": "PAGE_BBOX",
                    "page": 1
                  },
                  "normalized_hash": "sha256:d1d371f04aa0050f6d401614cdb8d5a99363d2953ad69d44478889fc6b0019f1"
                },
                {
                  "evidence_id": "ev_c303a07431cc533e765a",
                  "locator": {
                    "bbox": [
                      72.2,
                      232.534,
                      405.347,
                      240.234
                    ],
                    "block_index": 8,
                    "kind": "PAGE_BBOX",
                    "page": 1
                  },
                  "normalized_hash": "sha256:05a9a7030bb2257a7039955dbc724e3acf123ad7d76c060d46768c2ce5e69426"
                },
                {
                  "evidence_id": "ev_f0a358de3e65990b61ba",
                  "locator": {
                    "bbox": [
                      72.2,
                      251.834,
                      405.347,
                      259.534
                    ],
                    "block_index": 9,
                    "kind": "PAGE_BBOX",
                    "page": 1
                  },
                  "normalized_hash": "sha256:565b6c428329c36c2a4dfb9454c8951f5d638732e6a3e2725d3f18e5ea1803ad"
                },
                {
                  "evidence_id": "ev_e6a5610a9c63186ed42f",
                  "locator": {
                    "bbox": [
                      72.2,
                      271.134,
                      409.628,
                      278.834
                    ],
                    "block_index": 10,
                    "kind": "PAGE_BBOX",
                    "page": 1
                  },
                  "normalized_hash": "sha256:c5383afa088a93827e37608930bd676499198baba107af277e29cb7f53a42b0e"
                },
                {
                  "evidence_id": "ev_76263dccc3119ac4adee",
                  "locator": {
                    "bbox": [
                      72.2,
                      290.434,
                      405.347,
                      298.134
                    ],
                    "block_index": 11,
                    "kind": "PAGE_BBOX",
                    "page": 1
                  },
                  "normalized_hash": "sha256:7045bd13227e5acf8918bfa82c3e142b34905e69cf15b6b2156d338e5cb9f991"
                }
              ],
              "role": "SUBMISSION_SUPPORT"
            }
          ],
          "visible_anchor_refs": [
            {
              "declared_ref": "submissions/submission_05.pdf#Elección y tabla de cálculos",
              "resolved_units": [
                {
                  "evidence_id": "ev_feec60e20d7ec1ae8c7d",
                  "locator": {
                    "bbox": [
                      67.2,
                      105.627,
                      118.613,
                      118.127
                    ],
                    "block_index": 2,
                    "kind": "PAGE_BBOX",
                    "page": 1
                  },
                  "normalized_hash": "sha256:285512032f13522046e62f6796ddecc3a425a5792e95cb832492d053e62d0f9d"
                },
                {
                  "evidence_id": "ev_eb6ad6f0bd45703e16ba",
                  "locator": {
                    "bbox": [
                      72.2,
                      174.634,
                      403.198,
                      182.334
                    ],
                    "block_index": 5,
                    "kind": "PAGE_BBOX",
                    "page": 1
                  },
                  "normalized_hash": "sha256:7534ce93353ae3bea4fdb0716e38bd5b0c735e49cc257ed906e57dffc951224a"
                },
                {
                  "evidence_id": "ev_3ea45e0cd35c8c3c2705",
                  "locator": {
                    "bbox": [
                      72.2,
                      193.934,
                      405.347,
                      201.634
                    ],
                    "block_index": 6,
                    "kind": "PAGE_BBOX",
                    "page": 1
                  },
                  "normalized_hash": "sha256:692eca935128dec215056e655fbfb6b04f89ad8f545dd8b500f05c0971bcc02f"
                },
                {
                  "evidence_id": "ev_637254fccf82757f2672",
                  "locator": {
                    "bbox": [
                      72.2,
                      213.234,
                      405.347,
                      220.934
                    ],
                    "block_index": 7,
                    "kind": "PAGE_BBOX",
                    "page": 1
                  },
                  "normalized_hash": "sha256:d1d371f04aa0050f6d401614cdb8d5a99363d2953ad69d44478889fc6b0019f1"
                },
                {
                  "evidence_id": "ev_c303a07431cc533e765a",
                  "locator": {
                    "bbox": [
                      72.2,
                      232.534,
                      405.347,
                      240.234
                    ],
                    "block_index": 8,
                    "kind": "PAGE_BBOX",
                    "page": 1
                  },
                  "normalized_hash": "sha256:05a9a7030bb2257a7039955dbc724e3acf123ad7d76c060d46768c2ce5e69426"
                },
                {
                  "evidence_id": "ev_f0a358de3e65990b61ba",
                  "locator": {
                    "bbox": [
                      72.2,
                      251.834,
                      405.347,
                      259.534
                    ],
                    "block_index": 9,
                    "kind": "PAGE_BBOX",
                    "page": 1
                  },
                  "normalized_hash": "sha256:565b6c428329c36c2a4dfb9454c8951f5d638732e6a3e2725d3f18e5ea1803ad"
                },
                {
                  "evidence_id": "ev_e6a5610a9c63186ed42f",